{
  "schemaVersion": 2,
  "kind": "risk-accepted-public-preview",
  "persistence": "until-manually-paused",
  "operatorIdentity": "msmummy@gmail.com",
  "planHash": "d8ec0852b37e3f163080fc4e142280800717d190fd36f08710d83b0f26a14073",
  "releaseDigest": "b58934d88674855ac714c9a117a0e08a866cb9aa28af6b31a81b9e91dd1075eb",
  "blockers": [
    "complete the 30-day resource, capacity, availability, and cost window with provider or facility evidence",
    "measured auth, RxDB pull, and RxDB push latency exceed their single-region beta p95 budgets"
  ],
  "blockerDigest": "b8492baa802b961ba5cd240e211e0fccc87498d7fd589370dde5f44c8ef7e6a8",
  "acceptedAt": "2026-10-12T20:01:54.156Z",
  "expiresAt": null,
  "nonWaivableSafeguards": {
    "trustedHttpsAndHsts": true,
    "exactPublicRouteAllowlist": true,
    "applicationSecurity": true,
    "backupAndRecovery": true,
    "zeroAcknowledgedWriteLoss": true,
    "zeroIntegrityFailures": true,
    "serviceReadiness": true,
    "emergencyAdmissionStop": true
  },
  "typedConfirmation": "ACCEPT_PERSISTENT_PUBLIC_PREVIEW_RISK:b58934d88674855ac714c9a117a0e08a866cb9aa28af6b31a81b9e91dd1075eb:d8ec0852b37e3f163080fc4e142280800717d190fd36f08710d83b0f26a14073:b8492baa802b961ba5cd240e211e0fccc87498d7fd589370dde5f44c8ef7e6a8"
}
